{
  "manifest": {
    "id": "knowledge-agent",
    "name": "Knowledge & Policy Agent",
    "owner": "team-platform",
    "description": "Authoritative retrieval and interpretation of organizational knowledge with citations.",
    "capabilities": [
      {
        "name": "knowledge.search",
        "description": "Hybrid search over the governed corpus.",
        "risk": "R0",
        "input_schema": { "type": "object" },
        "output_schema": { "type": "object" },
        "examples": [
          { "input": { "query": "change freeze policy" } },
          { "input": { "query": "incident runbook" } },
          { "input": { "query": "TLS standard" } }
        ]
      }
    ],
    "models": { "allowed": ["default-tier"] }
  },
  "version": "0.1.0",
  "lifecycle_state": "registered",
  "registered_at": "2026-07-10T08:00:00Z",
  "updated_at": "2026-07-10T08:00:00Z",
  "card_signature": "eyJhbGciOiJFZERTQSIsImtpZCI6InJlZy0xIn0.eyJmYWtlIjoicGF5bG9hZCJ9.c2ln"
}
